{"schemaVersion":"moonshot-kimi-k3-token-estimate-diagnostic-evidence.v3","requestSha256":"sha256:0d022667417c9897c29bde84421c041b775e32c58bac0e01ed940ca18a2a3b51","messagesSha256":"sha256:cafca82c19cd22dccaf96a32a616ef3a1a0eed49b9f7f2adc5f7b337317971c9","reviewMaterialSha256":"sha256:e461a9eb28a682af9b9930f383c774e1c05768d2c107c7540e02320f263844b1","sourceCommit":"3321fd054e22e01e7b34a0a23c655db521eccf7b","requestedModel":"kimi-k3","endpoint":"https://api.moonshot.ai/v1/tokenizers/estimate-token-count","responseReceived":true,"httpStatus":200,"contentType":"application/json; charset=utf-8","contentEncoding":null,"contentTypeObservedValid":true,"contentEncodingObservedValid":true,"responseEndpointMatched":true,"bodyRepresentation":"APPLICATION_LAYER_DECODED_BYTES","responseBodyByteLength":69,"responseBodySha256":"sha256:2534e2b372e4d5fa04344e69d940ead9177b15abea4be721fc8c2fd4785015dd","responseArtifact":"token-estimate-diagnostic-response.bin","jsonParsed":true,"schemaValidated":true,"semanticValidated":true,"failureStage":null,"reasonCode":null,"recordedAt":"2026-08-01T23:16:42.043Z","evidenceSha256":"sha256:4aba06c0a1521ebf5898e2b2027358c0e99877ae2d0f958cb8ffbcca411468d8","responseBodyComplete":true}